{
  "$comment": "Versioned, immutable workflow definition (FOUNDATION-core §5.7). v2 = v1 plus the per-document model choice passed to classify (input.model, a key from the installation's model list); v1 stays for its running instances and golden masters.",
  "workflow": "document-intake",
  "workflowVersion": "2",
  "conformanceTier": "semantic",
  "deadlineMs": 1800000,
  "operatorRole": "document.operator",
  "supervisorRole": "document.supervisor",
  "steps": [
    {
      "id": "classify",
      "capability": "document.classify",
      "capabilityVersion": "1",
      "sideEffects": "none",
      "inputs": { "artifactId": "$input.artifactId", "strategy": "$strategy", "documentType": "$input.documentType", "model": "$input.model" },
      "strategies": ["llm", "keyword"],
      "qualityBudget": 2,
      "technicalRetries": 2,
      "onFailed": { "QUALITY": "retryQuality", "BUSINESS": "review", "VALIDATION": "review" },
      "reviewRole": "document.reviewer"
    },
    {
      "id": "validate",
      "capability": "document.validate",
      "capabilityVersion": "1",
      "sideEffects": "none",
      "inputs": {
        "artifactId": "$input.artifactId",
        "sha256": "$steps.classify.payload.sha256",
        "documentType": "$steps.classify.payload.documentType",
        "strategy": "$strategy",
        "correctedDocumentType": "$input.documentType"
      },
      "technicalRetries": 2,
      "onFailed": { "QUALITY": "review", "BUSINESS": "review" },
      "reviewRole": "document.reviewer"
    },
    {
      "id": "stamp",
      "capability": "document.stamp",
      "capabilityVersion": "1",
      "sideEffects": "internal-write",
      "inputs": {
        "artifactId": "$input.artifactId",
        "sha256": "$steps.validate.payload.sha256",
        "documentType": "$steps.validate.payload.documentType",
        "stampText": "$input.stampText"
      },
      "technicalRetries": 2,
      "reconciliationBudget": 3
    }
  ]
}
